{
  "$schema": "https://json-schema.org/draft/2020-12/schema",
  "$id": "https://autodev.dev/protocols/public/v1/objective-event.schema.json",
  "title": "AutoDev Objective Event v1",
  "type": "object",
  "additionalProperties": false,
  "required": ["schema_version", "event_id", "type", "timestamp", "objective_id", "data"],
  "properties": {
    "schema_version": { "const": "1" },
    "event_id": { "type": "string", "minLength": 1 },
    "type": { "type": "string", "minLength": 1 },
    "timestamp": { "type": "string", "format": "date-time" },
    "objective_id": { "type": "string", "minLength": 1 },
    "run_id": { "type": ["string", "null"] },
    "task_id": { "type": ["string", "null"] },
    "data": { "type": "object", "additionalProperties": true }
  }
}
